{
  "$schema": "https://json-schema.org/draft/2020-12/schema",
  "type": "object",
  "additionalProperties": false,
  "required": [
    "schema_version",
    "artifact_type",
    "artifact_id",
    "workstream_id",
    "source_handoff_ref",
    "workflow_id",
    "inputs"
  ],
  "properties": {
    "schema_version": {
      "const": 1
    },
    "artifact_type": {
      "const": "scherzo.input_bundle.v1"
    },
    "artifact_id": {
      "type": "string"
    },
    "workstream_id": {
      "type": "string"
    },
    "source_handoff_ref": {
      "type": "string",
      "pattern": "^workstream-artifacts/sha256/[0-9a-f]{64}\\.json$"
    },
    "workflow_id": {
      "type": "string"
    },
    "inputs": {
      "type": "array",
      "items": {
        "type": "object",
        "additionalProperties": false,
        "required": [
          "name",
          "descriptor",
          "value_ref"
        ],
        "properties": {
          "name": {
            "type": "string"
          },
          "descriptor": {
            "type": "object",
            "additionalProperties": false,
            "required": [
              "kind"
            ],
            "properties": {
              "kind": { "type": "string" },
              "ref_type": { "type": "string" },
              "media_type": { "type": "string" },
              "artifact_type": { "type": "string" },
              "source": { "type": "object" },
              "validation": { "type": "object" },
              "metadata": { "type": "object" }
            }
          },
          "contract_type": {
            "type": "string"
          },
          "value_ref": {
            "type": "string",
            "pattern": "^workstream-artifacts/sha256/[0-9a-f]{64}\\.json$"
          }
        }
      }
    }
  }
}
