{
  "schema_version": 1,
  "artifact_type": "scherzo.input_bundle.v1",
  "artifact_id": "input-bundle-linear-liv-370-next",
  "workstream_id": "linear:LIV-370",
  "source_handoff_ref": "workstream-artifacts/sha256/aaaaaaaaaaaaaaaaaaaaaaaaaaaaaaaaaaaaaaaaaaaaaaaaaaaaaaaaaaaaaaaa.json",
  "workflow_id": "execplan-implementation",
  "inputs": [
    {
      "name": "exec_plan_bundle",
      "contract_type": "exec_plan_bundle",
      "descriptor": {
        "kind": "artifact_set",
        "media_type": "application/json",
        "artifact_type": "scherzo.exec_plan_bundle.v2"
      },
      "value_ref": "workstream-artifacts/sha256/bbbbbbbbbbbbbbbbbbbbbbbbbbbbbbbbbbbbbbbbbbbbbbbbbbbbbbbbbbbbbbbb.json"
    }
  ]
}
